{
  "$schema": "../schemas/theme.schema.json",
  "schema_version": 1,
  "theme_name": "sage-dark",
  "mode": "dark",
  "tokens": {
    "--bg": "#0A1311",
    "--surface": "#111D19",
    "--surface-raised": "#172621",
    "--border": "#25382F",
    "--text": "#E8EEE8",
    "--text-secondary": "#A2B2A8",
    "--text-muted": "#7F9288",
    "--accent": "#B79CFF",
    "--on-accent": "#160F2B",
    "--ok": "#7FCB8C",
    "--blocking": "#F2735F",
    "--warn": "#E9B44C",
    "--unverified": "#8EB6E8"
  },
  "ansi": {
    "accent": 141,
    "ok": 114,
    "blocking": 167,
    "warn": 179,
    "unverified": 110,
    "muted": 244
  }
}
