{
  "$schema": "../schemas/theme.schema.json",
  "schema_version": 1,
  "theme_name": "sage-light",
  "mode": "light",
  "tokens": {
    "--bg": "#F1F4F1",
    "--surface": "#FFFFFF",
    "--surface-raised": "#E7ECE7",
    "--border": "#D3DCD5",
    "--text": "#0E1C17",
    "--text-secondary": "#46564D",
    "--text-muted": "#5E6D64",
    "--accent": "#5A3CC8",
    "--on-accent": "#FFFFFF",
    "--ok": "#22743F",
    "--blocking": "#B23C2B",
    "--warn": "#875A04",
    "--unverified": "#2C5F9E"
  },
  "ansi": {
    "accent": 61,
    "ok": 29,
    "blocking": 124,
    "warn": 94,
    "unverified": 25,
    "muted": 244
  }
}
